,review_content,classified_sentiment,summarized_sentence,summarized_keywords,reply_message
0,我喜欢ASOS和所有的客户服务，他们非常可爱,Positive正面,ASOS和客户服务令人愉悦。,ASOS、客户服务、可爱,太好了！我们很高兴你喜欢ASOS和客户服务。我们一直致力于为每位客户提供最佳服务，使您有更好的购物
1,我的订单被放在外面，学校的孩子们抢了它，但这是由于Hermes把它放在外面，ASOS退款并立即解决了我的问题，Mairi非常友善和乐于助人。10/10的客户服务。,Positive正面,ASOS提供出色的10/10客户服务和亲切友好的Mairi，快速解决了由Hermes忘记放在里面造成的问题。,Hermes、ASOS、Mairi,非常抱歉听到您的订单在外面被抢！ASOS客服和Mairi的友好服务让您满意，我们非常开心！感谢您给
2,乐于助人和友好的员工。,Positive正面,有才华并乐于助人的友善员工。,友好、助人、员工,感谢您给予我们的宝贵意见，我们一直致力于保持一流的服务质量，同时也非常注重拥有乐于助人和友好
3,快速回复并确保他们的客户满意,Positive正面,通过快速回复确保客户满意。,快速回复、客户满意、,非常感谢您的宝贵反馈，我们非常重视您的体验，正在积极采取措施改进产品的质量和服务，感
4,Rebecca对我的问题耐心和乐于助人，但ASOS的配送似乎存在一些物流问题。我只收到了4个包裹中的1个，这些包裹被认为是在同一天交付的。,Negative负面,Rebecca服务周到，但ASOS的物流存在延迟问题，只收到了1个包裹中的4个包裹。,Rebecca、ASOS、物流问题,非常抱歉您只收到了1个包裹，据我所知，ASOS为每个订单都进行严格的跟踪和监督，所以我们会尽快
5,快速，友好，清晰的回答！完美，我喜欢ASOS的服务,Positive正面,ASOS提供出色的、快速、友好和清晰的客户服务。,快速、友好、清晰,感谢您给予我们宝贵的意见。我们致力于为客户提供礼貌、有效、友好以及周到的服务，以确保所有客户
6,连接在线聊天服务花了20多分钟。等待聊天开始时，客服助手需要18分钟才能回答我的问题，而且回答也非常没有帮助。总体而言，与其他在线聊天服务相比，服务很差。,Negative负面,凭借长时间的等待和不充分的帮助，这次在线聊天服务体验糟糕透顶。,1 连接在线聊天,对不起给您带来的不便！一般聊天服务的响应速度都应在10分钟以内，而您经历的等候时间实在令人抱歉。我
7,可怕的公司。我试图让他们交付，但遭遇了很多麻烦，所以我不会再使用他们了。不幸的是，我忘了告诉我的妻子，看着她经历同样的闹剧。这家公司怎么还能继续经营呢？,Negative负面,这家可怕的公司使得我遭受了很多麻烦，不幸的是，我的妻子也经历了一样的事，这家公司究竟能怎么继续经营,可怕的、交付、闹剧,很抱歉看到你所遭遇的糟糕遭遇。这样的公司总是会有客户使用其服务，但可以建议其他客户利用评论和论坛
8,非常有帮助，清晰和迅速,Positive正面,效率高效。,有用、清晰、快速,非常高兴能够帮助您，欢迎您继续使用我们的产品和服务！
9,订购了一只Vivienne Westwood手表，按时交付，但密封的包装里没有手表！圣诞节的压力！在试图找到快速解决此问题的方法（ASOS没有电话号码，而且聊天框会不断消失，除非你像键盘上的闪电一样快），我与Donique联系，他快速解决了这个问题，重新订购并在4个工作日内交付。这减轻了我的交付焦虑，因为这是我女儿的礼物。总体而言，友好和高效的服务，并且如果它到达（已确认有库存）并且里面有手表（！），我将再次成为快乐的客户。悲哀的是，当我们努力赚钱购买这些礼物时，人们（可能是在包装阶段）会偷窃。到目前为止，ASOS做得很好！,Netural中性,Donique的友好和高效服务排除了因圣诞节压力而导致的问题，ASOS做得很好！,服务友好、按时交付、,非常抱歉给您带来这样的不愉快经历。我们工作人员都在努力确保节日订单能够按时抵达，并值得称赞
