,review_content,classified_sentiment,summarized_sentence,summarized_keywords,reply_message
0,我喜欢ASOS和所有的客户服务，他们非常可爱,Positive正面,ASOS和它们优秀的客户服务令人喜爱。,ASOS、客户服务、可爱,太棒了！我们非常高兴你喜欢ASOS和我们的客户服务。我们致力于为客户提供最优质的服务，感谢您的肯
1,我的订单被放在外面，学校的孩子们抢了它，但这是由于Hermes把它放在外面，ASOS退款并立即解决了我的问题，Mairi非常友善和乐于助人。10/10的客户服务。,Positive正面,ASOS提供出色的客户服务，Mairi非常友好和热情。,Hermes、ASOS、Mairi,非常感谢您分享这个经历，我们非常欣赏Mairi的超级友好和乐于助人的服务，我们的客户是我们的第一要义
2,乐于助人和友好的员工。,Positive正面,友善乐助的员工。,友善，乐于助人，员,非常感谢您的评价，我们深知拥有一群乐于助人和友好的员工是非常重要的，我们将继续努力提供最好的
3,快速回复并确保他们的客户满意,Positive正面,通过快速回复来满足客户需求。,快速回复、客户满意、,感谢您反馈的宝贵意见，我们非常重视您的反馈，我们将持续改进，以提高您的客户体验。如果
4,Rebecca对我的问题耐心和乐于助人，但ASOS的配送似乎存在一些物流问题。我只收到了4个包裹中的1个，这些包裹被认为是在同一天交付的。,Negative负面,Rebecca提供了优质的客户服务，但ASOS出现了物流问题，只收到了一小部分订购的物品。,Rebecca、耐心、物流问题,很抱歉听到您有这样的体验。我们正在努力确保所有订单能够在最短的时间内准时送达，您的意见对我们至
5,快速，友好，清晰的回答！完美，我喜欢ASOS的服务,Positive正面,ASOS提供出色的服务。,快速、友好、清晰,太好了，很高兴你喜欢ASOS的服务！谢谢你的支持！我们会一直努力，满足客户的需求与期望。
6,连接在线聊天服务花了20多分钟。等待聊天开始时，客服助手需要18分钟才能回答我的问题，而且回答也非常没有帮助。总体而言，与其他在线聊天服务相比，服务很差。,Negative负面,聊天服务缓慢且没有帮助，比其他在线服务差。,在线聊天服务、等待,非常感谢你提出宝贵的意见，关于在线聊天服务的体验，我们非常抱歉，也正在努力改善服务，希望
7,可怕的公司。我试图让他们交付，但遭遇了很多麻烦，所以我不会再使用他们了。不幸的是，我忘了告诉我的妻子，看着她经历同样的闹剧。这家公司怎么还能继续经营呢？,Negative负面,这家公司令人难以置信，多少麻烦又让别人经历一次。,可怕的公司、遭遇麻烦,很抱歉听到您在使用我们的过程中遭遇了这些麻烦，我们会尽力改善。您的反馈和吐槽对我们来说十分宝
8,非常有帮助，清晰和迅速,Positive正面,非常有效。, 有用，清晰，速度,非常高兴你对我们服务的评价，我们将继续努力提供清晰和迅速的服务，为您带来更好的体验。
9,订购了一只Vivienne Westwood手表，按时交付，但密封的包装里没有手表！圣诞节的压力！在试图找到快速解决此问题的方法（ASOS没有电话号码，而且聊天框会不断消失，除非你像键盘上的闪电一样快），我与Donique联系，他快速解决了这个问题，重新订购并在4个工作日内交付。这减轻了我的交付焦虑，因为这是我女儿的礼物。总体而言，友好和高效的服务，并且如果它到达（已确认有库存）并且里面有手表（！），我将再次成为快乐的客户。悲哀的是，当我们努力赚钱购买这些礼物时，人们（可能是在包装阶段）会偷窃。到目前为止，ASOS做得很好！,Netural中性,ASOS的友好和高效的服务使得最终获得手表，但可能是在包装阶段人们窃取了此物品。,友好高效，礼物偷,非常抱歉给您带来烦恼！我们知道您圣诞节的重要性。但感谢Donique的热情帮助，您得到了快速解决的解
